{
  "complete": true,
  "format": "travel-transfer/1",
  "originals": [],
  "records": [
    {
      "fields": {
        "balances": {},
        "currency": null,
        "exponent": null,
        "incomplete_expense_ids": [],
        "participant_finals": [],
        "shared_total_minor": "0",
        "suggestions": [],
        "unconverted_expense_ids": [],
        "unconverted_settlement_ids": []
      },
      "id": "cost_ledger:root",
      "kind": "cost_ledger",
      "references": {},
      "source": {
        "fields": {
          "balances": "empty",
          "currency": "empty",
          "exponent": "empty",
          "incomplete_expense_ids": "empty",
          "participant_finals": "empty",
          "shared_total_minor": "present",
          "suggestions": "empty",
          "unconverted_expense_ids": "empty",
          "unconverted_settlement_ids": "empty"
        },
        "schema": "memories-trip-plan/1"
      },
      "visibility": "trip"
    },
    {
      "fields": {
        "currency": "AUD",
        "exponent": 2
      },
      "id": "cost_settings:root",
      "kind": "cost_settings",
      "references": {},
      "source": {
        "fields": {
          "currency": "present",
          "exponent": "present"
        },
        "provider": "trek"
      },
      "visibility": "trip"
    },
    {
      "fields": {},
      "id": "day_plan:root",
      "kind": "day_plan",
      "references": {},
      "source": {
        "fields": {},
        "schema": "memories-trip-plan/1"
      },
      "visibility": "trip"
    },
    {
      "fields": {
        "audience": "private",
        "balances": {},
        "currency": null,
        "exponent": null,
        "incomplete_expense_ids": [],
        "participant_finals": [],
        "personal_total_minor": "0",
        "personal_unconverted_expense_ids": [],
        "shared_total_minor": "0",
        "suggestions": [],
        "unconverted_expense_ids": [],
        "unconverted_settlement_ids": []
      },
      "id": "private_cost_ledger:root",
      "kind": "private_cost_ledger",
      "references": {},
      "source": {
        "fields": {
          "audience": "present",
          "balances": "empty",
          "currency": "empty",
          "exponent": "empty",
          "incomplete_expense_ids": "empty",
          "participant_finals": "empty",
          "personal_total_minor": "present",
          "personal_unconverted_expense_ids": "empty",
          "shared_total_minor": "present",
          "suggestions": "empty",
          "unconverted_expense_ids": "empty",
          "unconverted_settlement_ids": "empty"
        },
        "schema": "memories-trip-plan/1"
      },
      "visibility": "private"
    },
    {
      "fields": {
        "audience": "private",
        "days": {}
      },
      "id": "private_day_plan:root",
      "kind": "private_day_plan",
      "references": {},
      "source": {
        "fields": {
          "audience": "present",
          "days": "empty"
        },
        "schema": "memories-trip-plan/1"
      },
      "visibility": "private"
    },
    {
      "fields": {
        "amount_minor": "1225",
        "amount_text": "12.25",
        "category": "Other",
        "currency": "AUD",
        "days_text": "1",
        "expense_date": "",
        "exponent": 2,
        "fx_base_currency": "AUD",
        "fx_base_exponent": 2,
        "fx_direction": "base_per_source",
        "fx_rate": "1",
        "fx_rounding": "half_positive",
        "notes": "",
        "persons_text": "1",
        "sort_order_text": "0",
        "title": "Tickets",
        "trek_created_at": "2026-10-23 09:08:40",
        "trek_native_values": {
          "days": null,
          "exchange_rate": 1,
          "expense_date": null,
          "note": null,
          "persons": null,
          "sort_order": 0,
          "total_price": 12.25
        },
        "trek_paid_by_user_id": null,
        "trek_ticket_json": null
      },
      "id": "trek:budget_items:037c9214eef74cc3887f3a4f085b4e17d76280dafd273b0ee160c09c4ba1cfd4",
      "kind": "expenses",
      "references": {
        "place_id": null,
        "reservation_id": "trek:reservations:037c9214eef74cc3887f3a4f085b4e17d76280dafd273b0ee160c09c4ba1cfd4"
      },
      "source": {
        "fields": {
          "amount_minor": "present",
          "amount_text": "present",
          "category": "present",
          "currency": "present",
          "days_text": "present",
          "expense_date": "present",
          "exponent": "present",
          "fx_base_currency": "present",
          "fx_base_exponent": "present",
          "fx_direction": "present",
          "fx_rate": "present",
          "fx_rounding": "present",
          "notes": "present",
          "persons_text": "present",
          "sort_order_text": "present",
          "title": "present",
          "trek_created_at": "present",
          "trek_native_values": "present",
          "trek_paid_by_user_id": "present",
          "trek_ticket_json": "present"
        },
        "provider": "trek"
      },
      "visibility": "trip"
    },
    {
      "fields": {
        "created_at": "2026-10-23 09:08:40",
        "deleted": 0,
        "text": "Historical message",
        "trek_user_id": {
          "id": "1",
          "name": "testuser26"
        }
      },
      "id": "trek:collab_messages:037c9214eef74cc3887f3a4f085b4e17d76280dafd273b0ee160c09c4ba1cfd4",
      "kind": "chat_messages",
      "references": {
        "reply_to": null
      },
      "source": {
        "fields": {
          "created_at": "present",
          "deleted": "present",
          "text": "present",
          "trek_user_id": "present"
        },
        "provider": "trek"
      },
      "visibility": "trip"
    },
    {
      "fields": {
        "check_in_end": "",
        "check_in_start": "",
        "check_out": "",
        "confirmation": "",
        "notes": "Two nights",
        "title": "Museum",
        "trek_created_at": "2026-10-23 09:08:40",
        "trek_native_values": {
          "check_in": null,
          "check_in_end": null,
          "check_out": null,
          "confirmation": null
        }
      },
      "id": "trek:day_accommodations:037c9214eef74cc3887f3a4f085b4e17d76280dafd273b0ee160c09c4ba1cfd4",
      "kind": "stays",
      "references": {
        "end_day_id": "trek:days:037c9214eef74cc3887f3a4f085b4e17d76280dafd273b0ee160c09c4ba1cfd4",
        "place_id": "trek:places:037c9214eef74cc3887f3a4f085b4e17d76280dafd273b0ee160c09c4ba1cfd4",
        "start_day_id": "trek:days:037c9214eef74cc3887f3a4f085b4e17d76280dafd273b0ee160c09c4ba1cfd4"
      },
      "source": {
        "fields": {
          "check_in_end": "present",
          "check_in_start": "present",
          "check_out": "present",
          "confirmation": "present",
          "notes": "present",
          "title": "present",
          "trek_created_at": "present",
          "trek_native_values": "present"
        },
        "provider": "trek"
      },
      "visibility": "trip"
    },
    {
      "fields": {
        "end_at": {},
        "ends_day": false,
        "incoming_transport_mode": "",
        "notes": "",
        "position": 2,
        "start_at": {},
        "title": "Museum",
        "transport_mode": "",
        "trek_created_at": "2026-10-23 09:08:40",
        "trek_native_values": {
          "assignment_end_time": null,
          "assignment_time": null,
          "end_day": 0,
          "incoming_leg_transport_mode": null,
          "leg_transport_mode": null,
          "notes": null
        },
        "trek_reservation_datetime": null,
        "trek_reservation_notes": null,
        "trek_reservation_status": "none",
        "trek_route_excluded": 0,
        "trek_tour_stage_key": null
      },
      "id": "trek:day_assignments:037c9214eef74cc3887f3a4f085b4e17d76280dafd273b0ee160c09c4ba1cfd4",
      "kind": "items",
      "references": {
        "day_id": "trek:days:037c9214eef74cc3887f3a4f085b4e17d76280dafd273b0ee160c09c4ba1cfd4",
        "place_id": "trek:places:037c9214eef74cc3887f3a4f085b4e17d76280dafd273b0ee160c09c4ba1cfd4",
        "stay_id": "trek:day_accommodations:037c9214eef74cc3887f3a4f085b4e17d76280dafd273b0ee160c09c4ba1cfd4"
      },
      "source": {
        "fields": {
          "end_at": "present",
          "ends_day": "present",
          "incoming_transport_mode": "present",
          "notes": "present",
          "position": "present",
          "start_at": "present",
          "title": "present",
          "transport_mode": "present",
          "trek_created_at": "present",
          "trek_native_values": "present",
          "trek_reservation_datetime": "present",
          "trek_reservation_notes": "present",
          "trek_reservation_status": "present",
          "trek_route_excluded": "present",
          "trek_tour_stage_key": "present"
        },
        "provider": "trek"
      },
      "visibility": "trip"
    },
    {
      "fields": {
        "date": "2027-02-01",
        "notes": "",
        "position": 1,
        "title": "",
        "transport_mode": "",
        "trek_native_values": {
          "default_transport_mode": null,
          "notes": null,
          "title": null
        }
      },
      "id": "trek:days:037c9214eef74cc3887f3a4f085b4e17d76280dafd273b0ee160c09c4ba1cfd4",
      "kind": "days",
      "references": {},
      "source": {
        "fields": {
          "date": "present",
          "notes": "present",
          "position": "present",
          "title": "present",
          "transport_mode": "present",
          "trek_native_values": "present"
        },
        "provider": "trek"
      },
      "visibility": "trip"
    },
    {
      "fields": {
        "title": "Packing"
      },
      "id": "trek:packing-list",
      "kind": "packing_lists",
      "references": {},
      "source": {
        "fields": {
          "title": "present"
        },
        "provider": "trek"
      },